<?xml version="1.0" encoding="UTF-8" ?>
<!DOCTYPE settings4j:configuration SYSTEM "http://settings4j.org/archiv/1.0.0-beta-SNAPSHOT/XMLSchema/settings4j.dtd">
<!--
	Licensed to the Apache Software Foundation (ASF) under one or more
	contributor license agreements.  See the NOTICE file distributed with
	this work for additional information regarding copyright ownership.
	The ASF licenses this file to You under the Apache License, Version 2.0
	(the "License"); you may not use this file except in compliance with
	the License.  You may obtain a copy of the License at
	
	http://www.apache.org/licenses/LICENSE-2.0
	
	Unless required by applicable law or agreed to in writing, software
	distributed under the License is distributed on an "AS IS" BASIS,
	WITHOUT WARRANTIES OR CONDITIONS OF ANY KIND, either express or implied.
	See the License for the specific language governing permissions and
	limitations under the License.
-->

<settings4j:configuration xmlns:settings4j='http://settings4j.org/'>

	<connector name="HibernateDBConnector"
		class="org.settings4j.connector.db.HibernateDBConnector">
		<param name="hibernateConfigXmlKeys" value="org/settings4j/hibernate.cfg.xml" />
		<contentResolver-ref ref="DefaultContentResolver" />
		<objectResolver-ref ref="DefaultObjectResolver" />
	</connector>
	
	<connector name="SystemPropertyConnector"
		class="org.settings4j.connector.SystemPropertyConnector">
		<contentResolver-ref ref="DefaultContentResolver" />
		<objectResolver-ref ref="DefaultObjectResolver" />
	</connector>
	
	<connector name="ClasspathConnector" class="org.settings4j.connector.ClasspathConnector" >
		<objectResolver-ref ref="DefaultObjectResolver" />
	</connector>

	<contentResolver name="DefaultContentResolver" class="org.settings4j.contentresolver.UnionContentResolver">
		<contentResolver-ref ref="FSContentResolver" />
		<contentResolver-ref ref="ClasspathContentResolver" />
	</contentResolver>

	<contentResolver name="FSContentResolver"
		class="org.settings4j.contentresolver.FSContentResolver">
	</contentResolver>

	<contentResolver name="ClasspathContentResolver"
		class="org.settings4j.contentresolver.ClasspathContentResolver">
	</contentResolver>

	<objectResolver name="DefaultObjectResolver" class="org.settings4j.objectresolver.UnionObjectResolver">
		<objectResolver-ref ref="JavaXMLBeansObjectResolver" />
		<objectResolver-ref ref="SpringConfigObjectResolver" />
	</objectResolver>
	
	<objectResolver name="JavaXMLBeansObjectResolver" class="org.settings4j.objectresolver.JavaXMLBeansObjectResolver">
	</objectResolver>
	
	<objectResolver name="SpringConfigObjectResolver" class="org.settings4j.objectresolver.SpringConfigObjectResolver">
	</objectResolver>
	
</settings4j:configuration>